{
  "slug": "doa-hordi-bean-2024-01",
  "source_slug": "doa-hordi-bean-2024",
  "chunk_idx": 0,
  "language": "en",
  "title": "Bean variety ladder — pole vs bush, and when Kekulu Bonchi beats them both",
  "body": "HORDI's bean portfolio is split into two architectures. Pole-climbing types (Balangoda Nil, Bandarawela Green, Gannoruwa BIL, Kekulu Bonchi, Gannoruwa Green, Kappetipola Nil, HORDI Green, Kentucky Wonder Green, Lanka Butter, HORDI Bean-03) plant at 50 × 40 cm with 50 kg seed/ha and start producing after day 60; bush types (Cherokee Wax, Sanjaya, Wade, Top Crop) plant tighter at 50 × 15 cm with 75 kg seed/ha and start after day 45. Standard bush types yield 5–10 t/ha; Gannoruwa BIL pole bean reaches 20 t/ha; Kekulu Bonchi peaks at 25 t/ha. The catch: all varieties need flowering-stage temperatures under 30 °C, so commercial production concentrates in Badulla, Nuwara Eliya, Matale, and Kandy districts — the up-country wet and intermediate zones.",
  "body_translated": {
    "en": "HORDI's bean portfolio is split into two architectures. Pole-climbing types (Balangoda Nil, Bandarawela Green, Gannoruwa BIL, Kekulu Bonchi, Gannoruwa Green, Kappetipola Nil, HORDI Green, Kentucky Wonder Green, Lanka Butter, HORDI Bean-03) plant at 50 × 40 cm with 50 kg seed/ha and start producing after day 60; bush types (Cherokee Wax, Sanjaya, Wade, Top Crop) plant tighter at 50 × 15 cm with 75 kg seed/ha and start after day 45. Standard bush types yield 5–10 t/ha; Gannoruwa BIL pole bean reaches 20 t/ha; Kekulu Bonchi peaks at 25 t/ha. The catch: all varieties need flowering-stage temperatures under 30 °C, so commercial production concentrates in Badulla, Nuwara Eliya, Matale, and Kandy districts — the up-country wet and intermediate zones.",
    "si": "HORDI බෝංචි පවුල ගෘහ නිර්මාණ දෙකකට බෙදී ඇත. පොල්ල අල්ලා නගින ප්‍රභේද (බලංගොඩ නිල්, බණ්ඩාරවෙල ග්‍රීන්, ගන්නෝරුව BIL, කැකුළු බෝංචි, ගන්නෝරුව ග්‍රීන්, කැප්පෙටිපොල නිල්, HORDI ග්‍රීන්, කෙන්ටකි වන්ඩර් ග්‍රීන්, ලංකා බටර්, HORDI බෝංචි-03) පරතරය 50 × 40 cm, බීජ 50 kg/හෙක්, දින 60 න් පසු අස්වනු දෙයි; පඳුරු ප්‍රභේද (චෙරෝකී වැක්ස්, සංජය, වේඩ්, ටොප් ක්‍රොප්) පරතරය 50 × 15 cm වලින් ටිකක් සමීපයි, බීජ 75 kg/හෙක්, දින 45 න් පසු අස්වනු දෙයි. සාමාන්‍ය පඳුරු ප්‍රභේද ටොන් 5-10/හෙක්.; ගන්නෝරුව BIL පොල්ල බෝංචි ටොන් 20/හෙක්.; කැකුළු බෝංචි උපරිම ටොන් 25/හෙක්. අනතුර: සියලු ප්‍රභේද සඳහා පිපීමේ අදියරේ උෂ්ණත්වය 30 °C ට අඩු විය යුතුය, එබැවින් වාණිජ නිෂ්පාදනය බදුල්ල, නුවරඑළිය, මාතලේ, සහ මහනුවර දිස්ත්‍රික්කවල — උඩරට තෙත් සහ අතරමැදි කලාපවල — මුල් බැස ඇත."
  },
  "entity_refs": [
    { "type": "crop", "slug": "beans" },
    { "type": "cultivation_plan", "slug": "beans-pole-up-country" }
  ],
  "authority": "doa_official",
  "applies_to_aez_codes": ["WU1","WU2","WU3","IU1","IU2","IU3"],
  "applies_to_countries": ["LK"],
  "topic_tags": ["beans", "variety_selection", "spacing", "up_country", "temperature"],
  "confidence": 0.95,
  "quote": "Up Country Intermediate Zone and Up-Country Wet Zone (Badulla, Nuwara Eliya, Matale, Kandy); temperature <30°C during flowering. Bush 5-10 t/ha; Gannoruwa BIL 20 t/ha; Kekulu Bonchi 25 t/ha.",
  "status": "draft",
  "field_provenance": {
    "authored_by": "ingestion-agent",
    "fetched_at": "2026-04-23T00:00:00Z",
    "source_url": "https://doa.gov.lk/hordi-crop-bean/"
  }
}
