{
  "slug": "doa-hordi-brinjal-2024-01",
  "source_slug": "doa-hordi-brinjal-2024",
  "chunk_idx": 0,
  "language": "en",
  "title": "Brinjal variety selection for disease and yield",
  "body": "HORDI's released brinjal portfolio covers three yield/resistance profiles: hybrid F1s Amanda and Anjalee deliver 30–40 t/ha with stronger tolerance to bacterial wilt when rotated correctly; HORDI Lenairi 1 is an OP selection bred for dry-zone adaptation; Thinnaweli Purple, Padagoda, and SM 164 are OP / heirloom lines that yield 18–20 t/ha but carry farmer-preferred flavour and storage traits. Variety choice should anchor on the AEZ (dry-zone farmers see less Ralstonia pressure on OPs) and on whether the buyer premium is worth the hybrid seed cost.",
  "body_translated": {
    "en": "HORDI's released brinjal portfolio covers three yield/resistance profiles: hybrid F1s Amanda and Anjalee deliver 30–40 t/ha with stronger tolerance to bacterial wilt when rotated correctly; HORDI Lenairi 1 is an OP selection bred for dry-zone adaptation; Thinnaweli Purple, Padagoda, and SM 164 are OP / heirloom lines that yield 18–20 t/ha but carry farmer-preferred flavour and storage traits. Variety choice should anchor on the AEZ (dry-zone farmers see less Ralstonia pressure on OPs) and on whether the buyer premium is worth the hybrid seed cost.",
    "si": "HORDI නිකුත් කළ වම්බටු පවුල අස්වැන්න/ප්‍රතිරෝධය අනුව වර්ග තුනක් ආවරණය කරයි: හයිබ්‍රිඩ් F1 ප්‍රභේද වන අමන්දා සහ අන්ජලී ටොන් 30-40/හෙක්. ලබා දෙයි, නිවැරදිව මාරු කළ විට බැක්ටීරියා ගහනය දරා ගැනීම වැඩි; HORDI ලෙනේරි 1 වියළි කලාපයට ගළපා ඇති OP ප්‍රභේදයකි; තින්නෙවෙලි දම්, පදගොඩ, සහ SM 164 OP / පාරම්පරික ප්‍රභේද ටොන් 18-20/හෙක්. ලබා දෙන අතර ගොවියාගේ රසය සහ ගබඩා කිරීමේ ලක්ෂණ තිබේ. ප්‍රභේද තේරීමේදී AEZ (වියළි කලාප ගොවීන්ට Ralstonia පීඩනය අඩුයි OP සඳහා) සහ හයිබ්‍රිඩ් බීජ පිරිවැය මිලදී ගැනීමේ වටිනාකම විශ්ලේෂණය කරන්න.",
    "ta": "HORDI வெளியிட்ட கத்தரிக்காய் தொகுப்பு மூன்று மகசூல்/எதிர்ப்பு சுயவிவரங்களை உள்ளடக்குகிறது: ஹைப்ரிட் F1 அமாண்டா மற்றும் அஞ்சலீ 30-40 டன்/ஹெக்டேர் தருகின்றன, சரியாக சுழற்சி செய்யப்பட்டால் பாக்டீரியா வாட்டத்தை வலுவாக தாங்கும்; HORDI லெனாரி 1 வறண்ட வலயத்திற்கு இனப்பெருக்கம் செய்யப்பட்ட OP தேர்வு; தின்னவேலி பர்ப்பிள், படகொட, SM 164 ஆகியவை OP / பாரம்பரிய வகைகள், 18-20 டன்/ஹெக்டேர் மகசூல் தருகின்றன ஆனால் விவசாயி விரும்பும் சுவை மற்றும் சேமிப்பு பண்புகள் உள்ளன. வகை தேர்வு AEZ-ஐ அடிப்படையாக கொண்டதாக இருக்க வேண்டும் (வறண்ட வலய விவசாயிகள் OP-க்களில் குறைவான Ralstonia அழுத்தம் காண்கிறார்கள்) மற்றும் வாங்குபவர் கூடுதல் கட்டணம் ஹைப்ரிட் விதை செலவை மதிப்பதா என்பதை அடிப்படையாக கொண்டதாக இருக்க வேண்டும்."
  },
  "entity_refs": [
    { "type": "crop", "slug": "brinjal" },
    { "type": "cultivation_plan", "slug": "brinjal-low-mid-country" }
  ],
  "authority": "doa_official",
  "applies_to_countries": ["LK"],
  "topic_tags": ["brinjal", "variety_selection", "bacterial_wilt", "yield"],
  "confidence": 0.9,
  "quote": "Released varieties: Amanda F1, Anjalee-F1, HORDI Lenairi 1, Thinnaweli purple, Padagoda, SM 164. OPV gives 18-20 t/ha and hybrids give 30-40 t/ha.",
  "status": "draft",
  "field_provenance": {
    "authored_by": "ingestion-agent",
    "fetched_at": "2026-04-22T00:00:00Z",
    "source_url": "https://doa.gov.lk/hordi-crop-brinjal/"
  }
}
