{
  "slug": "doa-hordi-tomato-2024-01",
  "source_slug": "doa-hordi-tomato-2024",
  "chunk_idx": 0,
  "language": "en",
  "title": "HORDI pesticide regimen for tomato early + late blight",
  "body": "HORDI recommends three fungicide options for tomato early blight (Alternaria solani) and late blight (Phytophthora infestans): Mancozeb 80% WP at 20 g per 10 L water; Metalaxyl 8% + Mancozeb 64% WP at 12.5 g per 10 L; or Metiram 55% + Pyraclostrobin 5% WG at 8 ml per 10 L. Rotate products across applications to slow resistance build-up, and only apply at first lesion appearance. These dosages trace back to the DOA 2019 pesticide recommendation.",
  "body_translated": {
    "en": "HORDI recommends three fungicide options for tomato early blight (Alternaria solani) and late blight (Phytophthora infestans): Mancozeb 80% WP at 20 g per 10 L water; Metalaxyl 8% + Mancozeb 64% WP at 12.5 g per 10 L; or Metiram 55% + Pyraclostrobin 5% WG at 8 ml per 10 L. Rotate products across applications to slow resistance build-up, and only apply at first lesion appearance. These dosages trace back to the DOA 2019 pesticide recommendation.",
    "si": "තක්කාලි මුල් අළු රෝගය (Alternaria solani) සහ අවසන් අළු රෝගය (Phytophthora infestans) සඳහා HORDI විසින් දිලීර නාශක විකල්ප තුනක් නිර්දේශ කරයි: මැන්කොසෙබ් 80% WP ජලය ලීටර 10 කට ග්‍රෑම් 20; මෙටලක්සයිල් 8% + මැන්කොසෙබ් 64% WP ලී 10 කට ග්‍රෑම් 12.5; හෝ මෙටිරම් 55% + පයිරක්ලොස්ට්‍රොබින් 5% WG ලී 10 කට මිලී ලී 8. ප්‍රතිරෝධය ඉක්මනින් ඇති නොවන ලෙස යෙදුම්වලදී නිෂ්පාදන මාරු කරන්න; ප්‍රථම පැල්ලම් පෙනෙන විටම පමණක් යොදන්න. මේ මාත්‍රා DOA 2019 පළිබෝධ නාශක නිර්දේශයට අනුකූලයි.",
    "ta": "தக்காளி ஆரம்ப இலைச்சாறல் (Alternaria solani) மற்றும் பிந்தைய இலைச்சாறல் (Phytophthora infestans) க்கு HORDI மூன்று பூஞ்சைக்கொல்லி விருப்பங்களை பரிந்துரைக்கிறது: மான்கோசெப் 80% WP 10 லிட்டர் நீருக்கு 20 g; மெட்டலாக்சில் 8% + மான்கோசெப் 64% WP 10 L க்கு 12.5 g; அல்லது மெட்டிராம் 55% + பைராக்ளோஸ்ட்ரோபின் 5% WG 10 L க்கு 8 ml. எதிர்ப்பாற்றல் உருவாவதை தாமதப்படுத்த பயன்பாடுகளுக்கிடையில் தயாரிப்புகளை மாற்றவும்; முதல் புண்கள் தோன்றும் போது மட்டுமே தெளிக்கவும். இந்த அளவுகள் DOA 2019 பூச்சிக்கொல்லி பரிந்துரையின் படி."
  },
  "entity_refs": [
    { "type": "crop", "slug": "tomato" },
    { "type": "disease", "slug": "tomato-early-blight" },
    { "type": "disease", "slug": "tomato-late-blight" },
    { "type": "cultivation_plan", "slug": "tomato-low-mid-country" }
  ],
  "authority": "doa_official",
  "applies_to_countries": ["LK"],
  "topic_tags": ["tomato", "fungicide", "early_blight", "late_blight", "dosage"],
  "confidence": 0.98,
  "quote": "Mancozeb 80% WP – 20g/10l; Metelaxyl 8%+ Mancozeb 64% WP -12.5g/10l; Metiram 55% + Pyraclostrobin 5% WG – 8ml/10l.",
  "status": "draft",
  "field_provenance": {
    "authored_by": "ingestion-agent",
    "fetched_at": "2026-04-22T00:00:00Z",
    "source_url": "https://doa.gov.lk/hordi-crop-tomato/"
  }
}
