{
  "slug": "doa-hordi-sweet-potato-2024-01",
  "source_slug": "doa-hordi-sweet-potato-2024",
  "chunk_idx": 0,
  "language": "en",
  "title": "Sweet potato — 12 released varieties + the weevil problem nobody has solved",
  "body": "Sri Lanka's sweet potato portfolio is unusually broad — HORDI lists 12 released varieties: Wariyapola Red, CARI-9, CARI 273, CARI 426, Wariyapola White, Shanthi, Chithra, Gannoruwa White, Ama, Dawala, HORDI Malee, and Ranabima. Each tunes for a slightly different taste / skin-colour / drought-tolerance niche, but there's no variety with meaningful resistance to the #1 constraint: sweet potato weevil (Cylas formicarius). The weevil's larvae tunnel into tubers, rendering them unmarketable and making even good-yield fields commercially worthless. No fully effective chemical cure exists. HORDI's management bundle is: plant weevil-free vine cuttings, hill soil around stems as vines grow, rotate away from Ipomoea for 2+ years, collect and destroy infested tubers at harvest — and pick a variety that matures within 90 days so the weevil has less time to catch up. Yield target across all varieties: 15–25 t/ha with 55,000–60,000 cuttings per hectare.",
  "body_translated": {
    "en": "Sri Lanka's sweet potato portfolio is unusually broad — HORDI lists 12 released varieties: Wariyapola Red, CARI-9, CARI 273, CARI 426, Wariyapola White, Shanthi, Chithra, Gannoruwa White, Ama, Dawala, HORDI Malee, and Ranabima. Each tunes for a slightly different taste / skin-colour / drought-tolerance niche, but there's no variety with meaningful resistance to the #1 constraint: sweet potato weevil (Cylas formicarius). The weevil's larvae tunnel into tubers, rendering them unmarketable and making even good-yield fields commercially worthless. No fully effective chemical cure exists. HORDI's management bundle is: plant weevil-free vine cuttings, hill soil around stems as vines grow, rotate away from Ipomoea for 2+ years, collect and destroy infested tubers at harvest — and pick a variety that matures within 90 days so the weevil has less time to catch up. Yield target across all varieties: 15–25 t/ha with 55,000–60,000 cuttings per hectare.",
    "si": "ශ්‍රී ලංකාවේ බතල ප්‍රභේද තොගය අසාමාන්‍ය ලෙස පළල් — HORDI විසින් නිකුත් කළ ප්‍රභේද 12 ක් ලැයිස්තුගත කරයි: Wariyapola Red, CARI-9, CARI 273, CARI 426, Wariyapola White, Shanthi, Chithra, Gannoruwa White, Ama, Dawala, HORDI Malee සහ Ranabima. සෑම එකක්ම තරමක් වෙනස් රස / පිටත වර්ණ / වියළි තත්ත්වය ඉවසන අනුගත කරයි, නමුත් #1 බාධකයට — බතල කුඩ පළිබෝධකය (Cylas formicarius) — සැලකිය යුතු ප්‍රතිරෝධයක් ඇති ප්‍රභේදයක් නොමැත. කුඩ පළිබෝධක කීටයන් අල තුළට සුරන්ග සාදා ඒවා වෙළඳපොළට නොගැලපෙන තත්ත්වයට පත් කරන අතර හොඳ අස්වැන්නක් ඇති ගොයම් ක්ෂේත්‍ර වුවත් වාණිජමය වශයෙන් අගයක් නැති තත්ත්වයට පත් කරයි. සම්පූර්ණ ඵලදායී රසායනික ප්‍රතිකාරයක් නැත. HORDI කළමනාකරණ පැකේජය: කුඩ පළිබෝධක නොමැති වැල් කැපුම් රෝපණය කරන්න, වැල් වර්ධනය වන විට කඳ වටා පස මතු කරන්න, අවම වශයෙන් වසර 2 කට Ipomoea වෙතින් වෙනත් බෝගවලට මාරු වන්න, අස්වැන්නේදී ආසාදිත අල රැස් කර විනාශ කරන්න — සහ කුඩ පළිබෝධකයට කම් ඉඩ ලැබෙන පරිදි දින 90 ක් තුළ මේරෙන ප්‍රභේදයක් තෝරන්න. සියලු ප්‍රභේද සඳහා අස්වැන්න ඉලක්කය: 15–25 t/ha සහ හෙක්ටයාරයකට කැපුම් 55,000–60,000.",
    "ta": "இலங்கையின் சர்க்கரைவள்ளிக்கிழங்கு தொகுப்பு வழக்கத்திற்கு மாறாக விரிவானது — HORDI வெளியிட்ட 12 வகைகளை பட்டியலிடுகிறது: Wariyapola Red, CARI-9, CARI 273, CARI 426, Wariyapola White, Shanthi, Chithra, Gannoruwa White, Ama, Dawala, HORDI Malee, மற்றும் Ranabima. ஒவ்வொன்றும் சற்று வேறுபட்ட சுவை / தோல்-நிறம் / வறட்சி-தாங்கும் இடம் குறித்து அமைக்கப்பட்டுள்ளது, ஆனால் #1 தடையான சர்க்கரைவள்ளிக்கிழங்கு வீவில் (Cylas formicarius) குறிப்பிடத்தக்க எதிர்ப்பு கொண்ட வகை எதுவும் இல்லை. வீவிலின் லார்வாக்கள் கிழங்குகளுக்குள் சுரங்கம் அமைத்து அவற்றை சந்தைக்கு தகுதியற்றதாக ஆக்கி, நல்ல மகசூல் கொண்ட வயல்களையும் வணிக ரீதியாக மதிப்பற்றதாக மாற்றுகின்றன. முழுமையாக பயனுள்ள இரசாயன மருந்து இல்லை. HORDI நிர்வாக தொகுப்பு: வீவில் இல்லாத கொடி வெட்டுகளை நடவு செய்யுங்கள், கொடிகள் வளரும்போது தண்டுகளைச் சுற்றி மண்ணை ஏற்றுங்கள், Ipomoea-விலிருந்து 2+ ஆண்டுகளுக்கு பயிர் சுழற்சி செய்யுங்கள், அறுவடையின்போது பாதிக்கப்பட்ட கிழங்குகளை சேகரித்து அழியுங்கள் — மற்றும் வீவிலுக்கு பிடிக்க குறைவான நேரம் இருக்குமாறு 90 நாட்களுக்குள் முதிர்ச்சியடையும் வகையைத் தேர்ந்தெடுக்கவும். அனைத்து வகைகளுக்கும் மகசூல் இலக்கு: 15–25 t/ha, ஹெக்டருக்கு 55,000–60,000 வெட்டுகள்."
  },
  "entity_refs": [
    { "type": "crop", "slug": "sweet-potato" },
    { "type": "cultivation_plan", "slug": "sweet-potato-non-arid" },
    { "type": "pest", "slug": "sweet-potato-weevil" }
  ],
  "authority": "doa_official",
  "applies_to_countries": ["LK"],
  "topic_tags": ["sweet_potato", "variety_selection", "weevil", "cultural_control"],
  "confidence": 0.93,
  "quote": "Released Varieties: Wariyapola Red, CARI-9, CARI 273, CARI 426, Wariyapola White, Shanthi, Chithra, Gannoruwa White, Ama, Dawala, HORDI Malee, and Ranabima. Sweet potato weevil is the most harmful pest. For 1 ha – 55,000 – 60,000 cuttings needed. Yield: 15-25 t/ha.",
  "status": "draft",
  "field_provenance": {
    "authored_by": "ingestion-agent",
    "fetched_at": "2026-04-23T00:00:00Z",
    "source_url": "https://doa.gov.lk/hordi-crop-sweet-potato/"
  }
}
