{
  "slug": "doa-hordi-leeks-2024-01",
  "source_slug": "doa-hordi-leeks-2024",
  "chunk_idx": 0,
  "language": "en",
  "title": "Leeks — five-stage fertilizer rhythm for a 4.5-month up-country crop",
  "body": "Leeks (Allium ampeloprasum, cv. Large Long Summer) is one of the longest-duration vegetables on HORDI's up-country list — 4.5 months from transplant to harvest — and the fertilizer schedule is sized accordingly. Basal: Urea 85 + TSP 270 + MOP 50 kg/ha plus 10 t/ha organic manure. Then four monthly top-dressings: Urea 85 alone at months 1 and 3; Urea 85 + MOP 50 at months 2 and 4. The TSP is front-loaded at basal because the up-country red-yellow podzolic soils fix phosphorus tightly — splitting TSP doesn't improve uptake. The long-duration N programme supports the continuous leaf production that drives the 20–30 t/ha commercial yield. Crop concentrates in Nuwara Eliya and Badulla because the cool up-country climate is essential — leeks bolt and split below 1200 m elevation.",
  "body_translated": {
    "en": "Leeks (Allium ampeloprasum, cv. Large Long Summer) is one of the longest-duration vegetables on HORDI's up-country list — 4.5 months from transplant to harvest — and the fertilizer schedule is sized accordingly. Basal: Urea 85 + TSP 270 + MOP 50 kg/ha plus 10 t/ha organic manure. Then four monthly top-dressings: Urea 85 alone at months 1 and 3; Urea 85 + MOP 50 at months 2 and 4. The TSP is front-loaded at basal because the up-country red-yellow podzolic soils fix phosphorus tightly — splitting TSP doesn't improve uptake. The long-duration N programme supports the continuous leaf production that drives the 20–30 t/ha commercial yield. Crop concentrates in Nuwara Eliya and Badulla because the cool up-country climate is essential — leeks bolt and split below 1200 m elevation.",
    "si": "ලීක්ස් (Allium ampeloprasum, cv. Large Long Summer) HORDI උඩරට ලැයිස්තුවේ දීර්ඝතම කාල සීමාවන්ගෙන් එකකි — බද්ධ කිරීමේ සිට අස්වැන්න දක්වා මාස 4.5 ක් — සහ පොහොර කාල සටහන ඒ අනුව සකසා ඇත. මූලික: Urea 85 + TSP 270 + MOP 50 kg/ha සහ කාබනික පොහොර 10 t/ha. ඉන්පසු මාසිකව මතුපිට යෙදුම් හතරක්: 1 සහ 3 මාසවල Urea 85 පමණක්; 2 සහ 4 මාසවල Urea 85 + MOP 50. TSP මූලිකයේදී පූර්ණව යෙදෙන්නේ උඩරට රතු-කහ පෝඩ්සෝලික් පස පොස්පරස් දැඩිව නවත්වන බැවින් — TSP බෙදීමෙන් ලබා ගැනීම වැඩි නොවේ. දීර්ඝකාලීන N වැඩසටහන 20–30 t/ha වාණිජ අස්වැන්න ගෙන එන පත්‍ර අඛණ්ඩ නිෂ්පාදනයට උපකාරී වේ. බෝගය නුවරඑළිය සහ බදුල්ලේ කේන්ද්‍රගතයි, මන්ද සිසිල් උඩරට දේශගුණය අත්‍යවශ්‍යය — ලීක්ස් 1200 m ට අඩු උසවල බොල්ට් වී ඉරී යයි.",
    "ta": "லீக்ஸ் (Allium ampeloprasum, cv. Large Long Summer) HORDI மலைநாட்டு பட்டியலில் மிக நீண்ட கால காய்கறிகளில் ஒன்று — நாற்று நடவில் இருந்து அறுவடை வரை 4.5 மாதங்கள் — உர அட்டவணையும் அதற்கேற்ப அமைக்கப்பட்டுள்ளது. அடிப்படை: Urea 85 + TSP 270 + MOP 50 kg/ha மற்றும் இயற்கை உரம் 10 t/ha. பிறகு நான்கு மாதாந்திர மேல்-ஏற்றங்கள்: 1 மற்றும் 3 மாதங்களில் Urea 85 மட்டும்; 2 மற்றும் 4 மாதங்களில் Urea 85 + MOP 50. TSP அடிப்படையில் முழுமையாக ஏற்றப்படுகிறது ஏனெனில் மலைநாட்டு சிவப்பு-மஞ்சள் போட்சோலிக் மண் பாஸ்பரஸை இறுக்கமாக பிடித்துக்கொள்கிறது — TSP-ஐப் பிரிப்பது உறிஞ்சுதலை மேம்படுத்தாது. நீண்ட கால N திட்டம் 20–30 t/ha வணிக மகசூலை உருவாக்கும் தொடர்ச்சியான இலை உற்பத்திக்கு ஆதரவளிக்கிறது. பயிர் நுவரேலியா மற்றும் பதுளையில் குவிந்துள்ளது, ஏனெனில் குளிர் மலைநாட்டு காலநிலை அவசியம் — லீக்ஸ் 1200 m-க்கு குறைவான உயரங்களில் போல்ட் ஆகி பிளந்துவிடும்."
  },
  "entity_refs": [
    { "type": "crop", "slug": "leeks" },
    { "type": "cultivation_plan", "slug": "leeks-up-country" }
  ],
  "authority": "doa_official",
  "applies_to_aez_codes": ["WU1","WU2","WU3","IU1","IU2","IU3"],
  "applies_to_countries": ["LK"],
  "topic_tags": ["leeks", "fertilizer", "top_dressing", "up_country"],
  "confidence": 0.95,
  "quote": "Basal: Urea 85, TSP 270, MOP 50. Top dressing (1 & 3 months): Urea 85. Top dressing (2 & 4 months): Urea 85, MOP 50. Organic manure: 10 t/ha. Harvest Timeline: Approximately 4½ months post-transplanting. Yield: 20-30 t/ha.",
  "status": "draft",
  "field_provenance": {
    "authored_by": "ingestion-agent",
    "fetched_at": "2026-04-23T00:00:00Z",
    "source_url": "https://doa.gov.lk/hordi-crop-leeks/"
  }
}
