{
  "slug": "doa-hordi-cabbage-2024-01",
  "source_slug": "doa-hordi-cabbage-2024",
  "chunk_idx": 0,
  "language": "en",
  "title": "HORDI diamondback moth + looper control regime for cabbage",
  "body": "HORDI's recommended rotation for the two dominant lepidopteran pests on Sri Lankan cabbage is: for diamondback moth (Plutella xylostella) — Emamectin benzoate 5% SG at 8 g per 16 L water, or Chlorantraniliprole 200 g/L SC at 6 ml per 16 L; for cabbage looper (Trichoplusia ni) — Spinosad 25 g/L SC at 16 ml per 16 L, or Tebufenozide 200 g/L SC at 24 ml per 16 L. Alternating modes of action between applications is essential because diamondback moth develops resistance extremely quickly to single-MOA spray programmes.",
  "body_translated": {
    "en": "HORDI's recommended rotation for the two dominant lepidopteran pests on Sri Lankan cabbage is: for diamondback moth (Plutella xylostella) — Emamectin benzoate 5% SG at 8 g per 16 L water, or Chlorantraniliprole 200 g/L SC at 6 ml per 16 L; for cabbage looper (Trichoplusia ni) — Spinosad 25 g/L SC at 16 ml per 16 L, or Tebufenozide 200 g/L SC at 24 ml per 16 L. Alternating modes of action between applications is essential because diamondback moth develops resistance extremely quickly to single-MOA spray programmes.",
    "si": "ශ්‍රී ලංකාවේ ගෝවාවල ප්‍රධාන ලෙපිඩොප්ටෙරා පළිබෝධ දෙක සඳහා HORDI නිර්දේශිත ක්‍රියා මාරු කිරීම: දියමන්ති පිටි පූ (Plutella xylostella) — එමමෙක්ටින් බෙන්සොයේට් 5% SG ලී 16 කට ග්‍රෑම් 8, හෝ ක්ලෝරන්ට්‍රානිලිප්‍රෝල් 200 g/L SC ලී 16 කට මිලී ලී 6; ගෝවා ලූපර් (Trichoplusia ni) — ස්පිනොසැඩ් 25 g/L SC ලී 16 කට මිලී ලී 16, හෝ ටෙබුෆෙනොසයිඩ් 200 g/L SC ලී 16 කට මිලී ලී 24. දියමන්ති පිටි පූ කෙටි කාලයකින් ප්‍රතිරෝධතාව ගොඩනැගෙන නිසා, එක එක යෙදුමේදී ක්‍රියාකාරී ක්‍රමය මාරු කිරීම අත්‍යවශ්‍යයි.",
    "ta": "இலங்கை முட்டைக்கோஸில் ஆதிக்கம் செலுத்தும் இரு இதைசிறகுடைய பூச்சிகளுக்கு HORDI பரிந்துரைக்கும் மாற்றம்: வைர முதுகு அந்துப்பூச்சி (Plutella xylostella) க்கு — எமாமெக்டின் பென்சோயேட் 5% SG 16 L நீருக்கு 8 g, அல்லது குளோரான்ட்ரானிலிப்ரோல் 200 g/L SC 16 L க்கு 6 ml; முட்டைக்கோஸ் லூப்பர் (Trichoplusia ni) க்கு — ஸ்பினோசாட் 25 g/L SC 16 L க்கு 16 ml, அல்லது டெபுஃபெனோசைட் 200 g/L SC 16 L க்கு 24 ml. வைர முதுகு அந்துப்பூச்சி விரைவாக எதிர்ப்பாற்றல் உருவாக்கும் காரணத்தால், ஒவ்வொரு பயன்பாட்டிற்கும் செயல்முறையை மாற்றுவது அவசியம்."
  },
  "entity_refs": [
    { "type": "crop", "slug": "cabbage" },
    { "type": "pest", "slug": "diamondback-moth" },
    { "type": "pest", "slug": "cabbage-looper" },
    { "type": "cultivation_plan", "slug": "cabbage-up-country" }
  ],
  "authority": "doa_official",
  "applies_to_countries": ["LK"],
  "topic_tags": ["cabbage", "diamondback_moth", "cabbage_looper", "insecticide_resistance", "dosage"],
  "confidence": 0.98,
  "quote": "Diamond back moth – Emamectin benzoate 5% SG: 8g/16L; Chlorantraniliprole 200g/L SC: 6ml/16L. Cabbage looper – Spinosad 25g/L SC: 16ml/16L; Tebufenozide 200g/L SC: 24ml/16L.",
  "status": "draft",
  "field_provenance": {
    "authored_by": "ingestion-agent",
    "fetched_at": "2026-04-22T00:00:00Z",
    "source_url": "https://doa.gov.lk/hordi-crop-cabbage/"
  }
}
