{
  "slug": "doa-hordi-okra-2024-01",
  "source_slug": "doa-hordi-okra-2024",
  "chunk_idx": 0,
  "language": "en",
  "title": "Okra — four-stage urea + MOP ramp for a 50–100-day harvest window",
  "body": "HORDI runs okra on a notably aggressive top-dressing schedule compared to other vegetables: Urea + MOP at basal (50 + 25 kg/ha), 2 weeks (50 + 25), 5 weeks (100 + 50), and 8 weeks (100 + 50) — with TSP only at basal (195 kg/ha). The front-loaded N drives the continuous pod-set window: picking begins at ~50 days and runs every 2 days for up to 25 picks across 50–100 days after planting. OKH1 hybrid can reach 30 t/ha at this rate; OPVs like MI5, MI7, and Haritha yield 10–15 t/ha. The 5-week and 8-week dressings are the high-leverage ones — missing them sheds pod count sharply.",
  "body_translated": {
    "en": "HORDI runs okra on a notably aggressive top-dressing schedule compared to other vegetables: Urea + MOP at basal (50 + 25 kg/ha), 2 weeks (50 + 25), 5 weeks (100 + 50), and 8 weeks (100 + 50) — with TSP only at basal (195 kg/ha). The front-loaded N drives the continuous pod-set window: picking begins at ~50 days and runs every 2 days for up to 25 picks across 50–100 days after planting. OKH1 hybrid can reach 30 t/ha at this rate; OPVs like MI5, MI7, and Haritha yield 10–15 t/ha. The 5-week and 8-week dressings are the high-leverage ones — missing them sheds pod count sharply.",
    "si": "අනෙකුත් එළවළු හා සැසඳීමේදී HORDI විසින් බණ්ඩක්කාවලට දැඩි මතුපිට පොහොර වැඩසටහනක් යෝජනා කරයි: මූලික යෙදුම (50 + 25 kg/ha), සති 2 (50 + 25), සති 5 (100 + 50), සති 8 (100 + 50) — TSP කි.ග්‍රෑ. 195/හෙක් පමණක් මූලික වශයෙන්. ඉදිරිපස නයිට්‍රජන් මාත්‍රාව දින 50 සිට දින 2 කට වරක් නෙළීමේ කවුළුව පවත්වාගෙන යන අතර 50-100 දින පුරා පික් 25 දක්වා ලබා ගත හැකිය. මෙම මාත්‍රාවෙන් OKH1 හයිබ්‍රිඩ් ටොන් 30/හෙක් ලබා දෙයි; MI5, MI7, හරිත වැනි OPV ප්‍රභේද ටොන් 10-15/හෙක් ලබා දෙයි. සති 5 සහ 8 මාත්‍රා ඉතා වැදගත් — ඒවා මඟ හැරීමෙන් පොඩ් ගණන තියුනු ලෙස අඩු වේ.",
    "ta": "மற்ற காய்கறிகளுடன் ஒப்பிடும்போது HORDI வெண்டைக்காய்க்கு குறிப்பிடத்தக்க தீவிர மேல்-உர அட்டவணையை நடத்துகிறது: யூரியா + MOP அடிப்படை (50 + 25 kg/ha), 2 வாரங்கள் (50 + 25), 5 வாரங்கள் (100 + 50), மற்றும் 8 வாரங்கள் (100 + 50) — TSP அடிப்படையில் மட்டும் (195 kg/ha). முன்-நிரப்பப்பட்ட N தொடர் காய்-தொகுப்பு சாளரத்தை இயக்குகிறது: பறிப்பு ~50 நாட்களில் தொடங்கி 2 நாள் இடைவெளியில் 50-100 நாட்களுக்கு 25 பறிப்புகள் வரை ஓடுகிறது. இந்த அளவில் OKH1 ஹைப்ரிட் 30 டன்/ஹெக்டேர் எட்டலாம்; MI5, MI7, ஹரிதா போன்ற OPV வகைகள் 10-15 டன்/ஹெக்டேர் மகசூல் தரும். 5-வார மற்றும் 8-வார உரமிடல்கள் அதிக செல்வாக்கு கொண்டவை — அவற்றை தவறவிடுவது காய் எண்ணிக்கையை கூர்மையாக குறைக்கும்."
  },
  "entity_refs": [
    { "type": "crop", "slug": "okra" },
    { "type": "cultivation_plan", "slug": "okra-all-zones" }
  ],
  "authority": "doa_official",
  "applies_to_countries": ["LK"],
  "topic_tags": ["okra", "fertilizer", "top_dressing", "urea", "mop"],
  "confidence": 0.97,
  "quote": "Basal: Urea 50, TSP 195, MOP 25. Top dressing (2 weeks): Urea 50, MOP 25. Top dressing (5 weeks): Urea 100, MOP 50. Top dressing (8 weeks): Urea 100, MOP 50.",
  "status": "draft",
  "field_provenance": {
    "authored_by": "ingestion-agent",
    "fetched_at": "2026-04-23T00:00:00Z",
    "source_url": "https://doa.gov.lk/hordi-crop-okra/"
  }
}
